{
  "$schema": "https://metabuilder.dev/schemas/json-script.schema.json",
  "schemaVersion": "2.2.0",
  "package": "ui_level5",
  "description": "Level 5 God Panel functions for layout, tenant management, and data transfer",
  "functions": [
    {
      "id": "layout_render",
      "name": "render",
      "exported": true,
      "description": "Render the main Level 5 layout",
      "category": "ui"
    },
    {
      "id": "layout_navigator",
      "name": "navigator",
      "exported": true,
      "description": "Render navigation tabs component",
      "category": "ui"
    },
    {
      "id": "layout_supergod_sidebar",
      "name": "supergodSidebar",
      "exported": true,
      "description": "Render supergod sidebar component",
      "category": "layout"
    },
    {
      "id": "layout_supergod_toolbar",
      "name": "supergodToolbar",
      "exported": true,
      "description": "Render supergod toolbar component",
      "category": "layout"
    },
    {
      "id": "layout_supergod_content",
      "name": "supergodContent",
      "exported": true,
      "description": "Render supergod main content area",
      "category": "layout"
    },
    {
      "id": "tenants_render",
      "name": "renderTenants",
      "exported": true,
      "description": "Render tenants management panel",
      "category": "ui"
    },
    {
      "id": "tenants_create",
      "name": "createTenant",
      "exported": true,
      "description": "Create a new tenant",
      "category": "actions"
    },
    {
      "id": "tenants_delete",
      "name": "deleteTenant",
      "exported": true,
      "description": "Delete an existing tenant",
      "category": "actions"
    },
    {
      "id": "transfer_initiate",
      "name": "initiateTransfer",
      "exported": true,
      "description": "Initiate data transfer between tenants",
      "category": "actions"
    },
    {
      "id": "transfer_confirm",
      "name": "confirmTransfer",
      "exported": true,
      "description": "Confirm and execute pending transfer",
      "category": "actions"
    },
    {
      "id": "transfer_assign_god",
      "name": "assignGod",
      "exported": true,
      "description": "Assign god-level permissions to a user",
      "category": "actions"
    }
  ],
  "exports": {
    "functions": [
      "render",
      "navigator",
      "supergodSidebar",
      "supergodToolbar",
      "supergodContent",
      "renderTenants",
      "createTenant",
      "deleteTenant",
      "initiateTransfer",
      "confirmTransfer",
      "assignGod"
    ]
  }
}
