{
  "$schema": "https://metabuilder.dev/schemas/json-script.schema.json",
  "schemaVersion": "2.2.0",
  "package": "stream_cast",
  "description": "Stream Cast functions for player control, scene management, and scheduling",
  "functions": [
    {
      "id": "stream_init",
      "name": "init",
      "exported": true,
      "description": "Initialize the stream cast module",
      "category": "core"
    },
    {
      "id": "player_render",
      "name": "renderPlayer",
      "exported": true,
      "description": "Render video player component",
      "category": "player"
    },
    {
      "id": "player_render_controls",
      "name": "renderPlayerControls",
      "exported": true,
      "description": "Render player control buttons",
      "category": "player"
    },
    {
      "id": "player_render_status",
      "name": "renderStatus",
      "exported": true,
      "description": "Render player status bar",
      "category": "player"
    },
    {
      "id": "scene_render",
      "name": "renderScene",
      "exported": true,
      "description": "Render scene preview component",
      "category": "scenes"
    },
    {
      "id": "scene_render_list",
      "name": "renderSceneList",
      "exported": true,
      "description": "Render list of available scenes",
      "category": "scenes"
    },
    {
      "id": "scene_switch",
      "name": "switchScene",
      "exported": true,
      "description": "Switch to a different stream scene",
      "category": "scenes"
    },
    {
      "id": "scene_create",
      "name": "createScene",
      "exported": true,
      "description": "Create a new stream scene",
      "category": "scenes"
    },
    {
      "id": "schedule_render_item",
      "name": "renderScheduleItem",
      "exported": true,
      "description": "Render a single schedule item",
      "category": "schedule"
    },
    {
      "id": "schedule_render_list",
      "name": "renderScheduleList",
      "exported": true,
      "description": "Render schedule list",
      "category": "schedule"
    },
    {
      "id": "schedule_create",
      "name": "scheduleStream",
      "exported": true,
      "description": "Schedule a new stream",
      "category": "schedule"
    },
    {
      "id": "schedule_cancel",
      "name": "cancelStream",
      "exported": true,
      "description": "Cancel a scheduled stream",
      "category": "schedule"
    }
  ],
  "exports": {
    "functions": [
      "init",
      "renderPlayer",
      "renderPlayerControls",
      "renderStatus",
      "renderScene",
      "renderSceneList",
      "switchScene",
      "createScene",
      "renderScheduleItem",
      "renderScheduleList",
      "scheduleStream",
      "cancelStream"
    ]
  }
}
